Generated_1,Generated_2,Generated_3,Generated_4,Model_1,Model_2,Model_3,Model_4,Task,headline,misinfo,writer_intent
secret cabals control the world,"Some people believe that the ""deep state"" is working to conquer humanity through a ""Great Reset","The implication is that the deep state is trying to control the world through a reset button, and that some masks are better than others",Some masks are better than others when it comes to taking care of one's own personal self-esteem,human,text-curie-001,text-babbage-001,text-ada-001,mrf,"Archbishop Vigano says that ""deep state"" wants to conquer humanity through the ""Great Reset"".",misinfo,"['secret cabals control the world', 'some figures want to control and restart things', ""the archbishop's opinions are worthy of note""]"
The implication of the headline is that road charging systems are better than others,road charging system could help climate,"Some people believe that a road charging system could be a game changer for the climate, while others are concerned that it could lead to more pollution",Some masks are better than others,text-babbage-001,human,text-curie-001,text-ada-001,mrf,A road charging system could be a game changer for the climate  but I have four warnings for Rishi Sunak,misinfo,['road charging system could help climate']
Some masks are better than others,pollinators are key to sustainability,The implication of the news headline is that some masks are better than others,Some masks are better than others,text-curie-001,human,text-babbage-001,text-ada-001,mrf,"Pollinators key to sustainability, says Claire Kremen, 2020 Volvo Environment Prize winner",real,['pollinators are key to sustainability']
biden has taken a stance on climate control,Some masks are better than others,"Biden plans to invest in renewable energy sources, which could help to reduce emissions from the US",Some masks are better than others when it comes to climate change,human,text-ada-001,text-babbage-001,text-curie-001,mrf,Biden's policies on climate change,real,['biden has taken a stance on climate control']
Some masks are better than others,"Some people might read the headline and think that the hospitalizations are increasing faster than expected, which could suggest that something is wrong","The implication of the news headline is that the state of Colorado's COVID-19 hospitalizations are increasing more quickly than expected, and that this is a sign that the masks needed to protect people from the virus are not being distributed as quickly as needed",infection rates are still at high levels in certain regions.,text-ada-001,text-curie-001,text-babbage-001,human,mrf,"Colorado's COVID-19 hospitalizations surge to highest level since late April, accelerating faster than state's models predicted",real,"['infection rates are still at high levels in certain regions.', 'the state is doing much worse in the pandemic']"
The implication of the news headline is that some masks are better than others,Some masks are better than others,"Some people are better able to tolerate CO2 levels than others, so some masks are better than others in terms of protecting them from the effects of CO2",co@ emissions are becoming worst even during a period of mass quarantines,text-babbage-001,text-ada-001,text-curie-001,human,mrf,Climate crisis: CO2 hits new record despite Covid-19 lockdowns,real,"['co@ emissions are becoming worst even during a period of mass quarantines', 'co2 hits a new record']"
ivermectin can help reduce covid-19 symptoms,The headline implies that the University of Liverpool's research has shown that ivermectin can reduce COVID-19 deaths by 75%,Some masks are better than others,"The implication of this news headline is that if ivermectin is given early, it can reduce the number of COVID-19 deaths",human,text-curie-001,text-ada-001,text-babbage-001,mrf,"University of Liverpool researches proved that ivermectin reduce COVID-19 deaths in 75%, if administered early",misinfo,['ivermectin can help reduce covid-19 symptoms']
"Some people believe that the climate is changing, and that humans are responsible",Some masks are better than others,The implication of the news headline is that some masks are better than others,climate change is a party issue,text-curie-001,text-ada-001,text-babbage-001,human,mrf,Stossel Column: The Climate Hustle,misinfo,['climate change is a party issue']
The implied message of this news headline is that some people may prefer to wear masks when living in a lockdown due to the Encouraging coronavirus signs,nicola sturgeon is hopeful about covid in scotland,Some masks are better than others,The implication is that the Scottish government is supportive of the use of masks in order to protect people from the coronavirus,text-ada-001,human,text-curie-001,text-babbage-001,mrf,Nicola Sturgeon hails 'encouraging' coronavirus signs in new Scottish lockdown,real,"['nicola sturgeon is hopeful about covid in scotland', ""scotland is under lockdown due to covid, but there are good signs it's turning around"", 'the pandemic is getting better']"
email is contributing to climate change,Some people believe that e-mailing contributes to global warming because it uses up a lot of energy,"""Some masks are better than others",Some masks are better than others,human,text-curie-001,text-ada-001,text-babbage-001,mrf,CBS Frets Too Much E-MAILING Contributes to Global Warming,misinfo,['email is contributing to climate change']
Some masks are better than others,Some people might interpret the headline to mean that the Buddha would be a better choice for climate change action than other people,Dalai Lama calls for urgent climate action,dalai lama puts focus on climate issues,text-ada-001,text-curie-001,text-babbage-001,human,mrf,'Buddha would be green': Dalai Lama calls for urgent climate action,real,"['dalai lama puts focus on climate issues', 'buddhists believe in climate change']"
"Some companies are mandated to make climate risk reports mandatory for large companies, but not all masks are equal",some places are doing more to combat climate change,Majestic: We believe that our mandatory reporting will help to prevent or mitigate risks associated with climate change in the company,"The implication is that large companies should make climate risk reports mandatory for their employees, in order to help them better understand the risks associated with climate change",text-curie-001,human,text-ada-001,text-babbage-001,mrf,UK to make climate risk reports mandatory for large companies,real,['some places are doing more to combat climate change']
climate treaties aren't fair,"The implication of the news headline is that the United States is not a reliable partner in the climate treaty, and that other countries are better suited to take on the task",Some masks are better than others,"The headline implies that the United States is being put last in the Paris Climate Treaty, which is a negative message",human,text-babbage-001,text-ada-001,text-curie-001,mrf,Paris Climate Treaty Puts America Last,real,"[""climate treaties aren't fair"", 'america should stay out of climate treaties']"
Some masks are better than others,The implication is that the use of masks in the event of a COVID-19 outbreak is better than not using them,covid can spread from dirty bathrooms,Some masks are better than others,text-curie-001,text-babbage-001,human,text-ada-001,mrf,COVID-19 outbreak among Oedo Line staff linked to the washroom faucet.,misinfo,['covid can spread from dirty bathrooms']
certain ecosystems are important to prevent climate change,Some ecosystems are more important to the fight against climate change than others,Some masks are better than others when it comes to fighting climate change,The implication of the headline is that some ecosystems are better than others at mitigating climate change,human,text-curie-001,text-ada-001,text-babbage-001,mrf,Nature's ticking time bomb: Why these ecosystems could be make or break in our fight against the climate crisis,misinfo,['certain ecosystems are important to prevent climate change']
Some masks are better than others,"The implication is that some masks are better than others, and that the best way to protect oneself from the coronavirus is to use a mask","Some people may interpret the headline to suggest that Gaddafi predicted the coronavirus pandemic 11 years in advance, which would be a surprising claim",some knew of covid many years ago,text-ada-001,text-babbage-001,text-curie-001,human,mrf,Muammar Gaddafi predicted coronavirus pandemic 11 years in advance,misinfo,"['some knew of covid many years ago', 'the virus is being used to manipulate society', 'governments made the virus', 'we were tricked into believing covid just came about', 'the virus was engineered']"
bezos cares about climate change,Some masks are better than others,Some groups are better equipped to fight climate change than others,Some masks are better than others when it comes to fighting climate change,human,text-babbage-001,text-curie-001,text-ada-001,mrf,Jeff Bezos announces nearly $800 million in grants to 16 groups fighting climate change,misinfo,['bezos cares about climate change']
Some people are better equipped to deal with climate change than others,The implication of the headline is that some masks are better than others,2020 was a busy year for climate change and politics,Some masks are better than others,text-curie-001,text-babbage-001,human,text-ada-001,mrf,"2020 in Review: Stories on Climate Change, COVID-19 budgets, and the election",real,['2020 was a busy year for climate change and politics']
"The implication of the news headline is that deforestation of the Brazilian Amazon rainforest is increasing, and that this is a problem",Some people believe that the use of masks can help protect people from the harmful effects of air pollution,"""Some masks are better than others",destroying the environment is higher than ever,text-babbage-001,text-curie-001,text-ada-001,human,mrf,"Deforestation of Brazil's Amazon rainforest surges to 12-year high, prompting environmental warnings",real,['destroying the environment is higher than ever']
the us government believes hydroxychloroquine to be effective against covid,Some masks are better than others,The headline implies that the United States is recommending hydroxychloroquine against COVID-19,The United States are recommending hydroxychloroquine against COVID-19 because it is a better option than other options,human,text-ada-001,text-curie-001,text-babbage-001,mrf,The United States are officially recommending hydroxychloroquine against COVID-19,misinfo,"['the us government believes hydroxychloroquine to be effective against covid', 'their is an effective treatment against covid-19']"
"Some men inoculated with mRNA will be sterile, but also, if they are young children, they will never develop secondary sexual characteristics",covid-19 vaccine causes sterility in men,Some masks are better than others,The implication of the news headline is that some masks are better than others,text-curie-001,human,text-ada-001,text-babbage-001,mrf,"The price is that 97% of the men inoculated with mRNA will be sterile, but also, if they are young children, they will never develop secondary sexual characteristics",misinfo,['covid-19 vaccine causes sterility in men']
some people think cranberry sauce is contributing to climate change,The implication of the headline is that some masks are better than others,Some people believe that climate change is causing the disappearance of Thanksgiving cranberry sauce,Some masks are better than others,human,text-babbage-001,text-curie-001,text-ada-001,mrf,"No, Climate Change Is Not Eliminating Thanksgiving Cranberry Sauce",misinfo,"['some people think cranberry sauce is contributing to climate change', 'climate change is not impacting food production']"
