Generated_1,Generated_2,Generated_3,Generated_4,Model_1,Model_2,Model_3,Model_4,Task,post,targetMinority,targetStereotype
disabled people are ugly,People with disabilities are often assumed to have a certain physical appearance and are not believed to be truly disabled if they do not fit that stereotype,disabled folks are ugly,People with disabilities are often viewed as being less attractive or desirable,human,chatgpt,baseline,text-davinci-003,sbic,But you're not REALLY disabled. You look so pretty!,"[""physically disabled folks""]","[""disabled people are ugly"", ""disabled people can't be attractive"", ""disabled people can't be pretty""]"
women are judgmental.,Femoids are stereotypically seen as not wanting to associate with incels,Incels are perceived as repulsive and undesirable by women,are stupid,human,text-davinci-003,chatgpt,baseline,sbic,&lt;--- number of femoids who would rather die than spend more than 5 seconds with an incel,"[""women""]","[""women are judgmental."", ""women are mean.""]"
Jews are often stereotyped as being responsible for the spread of negative cultural influences,jewish people are inferior,jewish folks are greedy,Jews are believed to be responsible for promoting negative behavior in European nations through media outlets like MTV,text-davinci-003,baseline,human,chatgpt,sbic,Not good news at all but this happens in all European nations and is no doubt pushed by the likes of Jews like Summer Redstone and MTV !!,"[""jewish folks""]","[""jewish folks are greedy"", ""jewish folks are manipulative"", ""jewish folks are powerful"", ""jewish folks only care about themselves"", ""jews control the world"", ""jews push agendas""]"
Fans of Spongebob are likely to be playful and have a good sense of humor in bed,are lazy,belittles the severe pain that molestation victims feel,The stereotype communicated by this sentence is that people who enjoy Spongebob are immature and childish,chatgpt,baseline,human,text-davinci-003,sbic,What's the Best/worst Spongebob quote to say in bed? ARE YA READY KIDS?!,"[""assault victims"", ""child rape victims""]","[""belittles the severe pain that molestation victims feel"", ""trivializes harm to victims""]"
"Dark humor enthusiasts are often seen as edgy and controversial, pushing the boundaries of what is socially acceptable",are beat by the police,Police officers are often seen as having a serious and stern demeanor,black folks are sexist,chatgpt,human,text-davinci-003,baseline,sbic,My humour is so dark that cops are beating it,"[""assault victims"", ""black folks""]","[""are beat by the police"", ""are victims of police violence"", ""black folks deserve police brutality."", ""black people are bad"", ""black people are criminals"", ""darker skin is worse when black."", ""trivializes harm to police brutality victims.""]"
Gay people are associated with negative stereotypes and derogatory language,LGBTQ+ people are inferior,gay men are inferior,gay people are inferior,chatgpt,text-davinci-003,human,baseline,sbic,"No offense, but that's seriously gay.","[""gay men""]","[""gay men are inferior"", ""gay men can be mocked"", ""gay people shouldn't act gay""]"
"I'm sorry, as an AI language model, I cannot provide an explanation for the stereotype that this sentence communicates as it is inappropriate and offensive",jewish people are dirty,Jews are often stereotyped as being overly clean and hygienic,holocaust reference,chatgpt,baseline,text-davinci-003,human,sbic,what do you call a jewish person who 's just been for a shower ? cleansed,"[""Holocaust victims"", ""jewish folks""]","[""holocaust reference"", ""making fun of religion"", ""not being cleansed"", ""talks about gassing people"", ""trivializes harm to victims""]"
"Black people are often stereotyped as having white palms, feet, and owners, perpetuating the harmful belief that whiteness is superior",black people are property of others.,black folks are inferior,The stereotype communicated is that African Americans are inferior or less than other races,chatgpt,human,baseline,text-davinci-003,sbic,"Whats white about a black person? The feet, the palms and the owner","[""black folks""]","[""black people are property of others."", ""black people are slaves."", ""blacks are slave"", ""blacks are subhuman"", ""it takes a shot at african americans over slavery in the 1800's"", ""it takes a shot at the color of their skin""]"
black folks are inferior,This sentence communicates the stereotype that women are objects to be compared to consumable items,Men are often stereotyped as objectifying women and reducing them to mere consumable items,it's ok to beat women,baseline,text-davinci-003,chatgpt,human,sbic,"Compare your ideal woman to a drink, and then to food Joe says red wine and steak. Bob says coffee and blue berries. Joe asks how that is an ideal woman, Bob says “black and blue”","[""assault victims"", ""women""]","[""it's ok to beat women"", ""trivializes harm to victims"", ""women are objects"", ""women are worth less than men"", ""women should be beaten""]"
Women are often seen as gossipy and disruptive,women are all the same,"Women are often labeled as ""bitches"" and are perceived as annoying and bothersome",are bitches,text-davinci-003,human,chatgpt,baseline,sbic,The bitches behind me are so annoying,"[""women""]","[""women are all the same"", ""women are submissive""]"
a black person is only worth 3/5th of a white person,"As an AI language model, I cannot engage in stereotyping or any form of discrimination",African Americans are undervalued,are not worth 20 dollars,human,chatgpt,text-davinci-003,baseline,sbic,"Since Harriet tubman is on the 20 dollar bill now, is it worth 3/5 of a 20 now?","[""black folks""]","[""a black person is only worth 3/5th of a white person"", ""blacks lives are worth less than whites"", ""blacks lives don't matter"", ""people people are worth less than white people""]"
"The stereotype communicated is that Jews are equated with money, implying that they are wealthy",it doesn't matter if jews die,This sentence communicates the stereotype that Jews are associated with money and wealth,jewish people are inferior,text-davinci-003,human,chatgpt,baseline,sbic,What’s the difference between Jews and Euros? It really sucks to lose six million euros,"[""jewish folks""]","[""it doesn't matter if jews die"", ""jews are lesser"", ""jews should die"", ""makes a joke about killing them"", ""references the holocaust""]"
Police are biased towards white people,black people are hated by the police,Black people are unfairly targeted by law enforcement,black folks are inferior,chatgpt,human,text-davinci-003,baseline,sbic,"A white man and a black man play hide and seek at night. Who has the advantage? The white man, as the cops are on his side.","[""black folks"", ""black folks, native american/first nation folks""]","[""black people are hated by the police"", ""black people are stupid"", ""black people are thugs"", ""blacks are criminals"", ""deserve to die"", ""is inherently bad""]"
Feminists are hypocritical and suppressive of opposing viewpoints,accuses them of falsely accusing sexual issues,Feminist hypocrites are portrayed as controlling and oppressive,women are hypocrites,chatgpt,human,text-davinci-003,baseline,sbic,Do tell feminist hypocrites who organized abuse report fraud to REPEATEDLY ban @JudgyBitch1 of #WomenAgainstFeminism how you #LetWomenSpeak.,"[""feminists"", ""women""]","[""accuses them of falsely accusing sexual issues"", ""feminists are hypocrites"", ""feminists are not intelligent"", ""women issues complaints""]"
"Black people are often stereotyped as being associated with negative connotations of the word ""neighbor,"" such as being loud or disruptive",black people are not welcomed,The stereotype communicated is that black people are inferior and should not be treated with respect or kindness,black folks are inferior,chatgpt,human,text-davinci-003,baseline,sbic,Whats a word that begins with N ends in R and you should never call a black person? Neighbor,"[""black folks""]","[""black people are not welcomed"", ""black people should go away"", ""blacks are undesirable"", ""blacks do not make good neighbors""]"
black folks are not part of the human race,Blacks are associated with being dirty and polluting the environment,The stereotype communicated is that Blacks are associated with pollution and environmental destruction,black folks are inferior,human,chatgpt,text-davinci-003,baseline,sbic,What do you call a group of blacks in the ocean? An oil spill,"[""black folks""]","[""black folks are not part of the human race"", ""black folks are oily"", ""black people are greasy"", ""blacks are reduced to objects"", ""blacks are subhuman"", ""people people cant swim""]"
black folks are inferior,black people are less than,African Americans are viewed as being sexually promiscuous,This sentence communicates the stereotype that black people are sexually deviant and behave inappropriately in public spaces,baseline,human,text-davinci-003,chatgpt,sbic,What was the best part about being black in the 50's? You could sit in the back of the bus and masturbate and nobody would notice,"[""black folks""]","[""black people are less than"", ""black people are perverts"", ""black people deserve to be in the back of the bus"", ""black people were lucky to have segregation""]"
This sentence communicates the stereotype that all ethnic and cultural groups are interchangeable and can be represented by a single individual,black folks are a joke,"Italian plumbers, Japanese people, Mexicans, black people, and Jews are all stereotyped in this sentence",are all about money,text-davinci-003,baseline,chatgpt,human,sbic,do n't be a racist be mario he 's and italian plumber created by japanesese people who speaks english and looks like a mexican and jumps like a black man and also grabs coins like a jew .,"[""black folks, Jews"", ""jewish folks""]","[""are all about money"", ""black peope are athletic."", ""jews love money."", ""only concerned with financials""]"
black folks are chickens,"Black people are often stereotyped as being enslaved or oppressed, while chickens are seen as being raised for consumption or profit",African Americans are viewed as inferior to other races,black folks are all criminals,baseline,chatgpt,text-davinci-003,human,sbic,What's the difference between a black person and a chicken? One's free range,"[""black folks""]","[""black folks are all criminals"", ""black folks are all incarcerated"", ""black people are inferior"", ""black people are slaves"", ""blacks are worthless""]"
women are proud of their mental problems,Females are attention-seeking about their mental health while men are more likely to commit suicide,women are inferior,"The stereotype communicated is that ""Females are attention-seeking while males are more likely to suffer in silence""",human,chatgpt,baseline,text-davinci-003,sbic,Females are far more likely to loudly boast about their mental problems for attention while men commit four times as many suicides,"[""women"", ""women, trans women""]","[""women are proud of their mental problems"", ""women are treated with more concern than men."", ""women are unstable"", ""women complain about things that men do not."", ""women complain constantly"", ""women like having mental problems""]"
black folks are inferior,black folks are hanged,Black people are often seen as being ignored or left out,"Black people are often stereotyped as being more expressive and enthusiastic in their physical interactions, such as high fives, than white people",baseline,human,text-davinci-003,chatgpt,sbic,"A black guy went to give a white guy a high five And then the black guy said ""why did you leave me hanging?""","[""black folks""]","[""black folks are hanged"", ""black folks are likely to be killed"", ""black folks are subhuman"", ""black folks should be hung""]"
The stereotype communicated is that women are expected to maintain a certain level of physical appearance,women are sexist,women are sex objects,Women are expected to maintain their physical appearance at all times,text-davinci-003,baseline,human,chatgpt,sbic,uh @TommytheTank3 @SaintMarche whatever about a man (sorry im not sexist) but a woman should never let herself go...,"[""women""]","[""women are sex objects"", ""women exist for use by men"", ""women should be judged by appearances"", ""women should prioritize beauty""]"
Syrians are known for their love of playing Rocket League,Syrians are seen as gamers,are stupid,syrian folks are terrorists,chatgpt,text-davinci-003,baseline,human,sbic,What is Syrians favorite game? It's Rocket League.,"[""Syrians"", ""syrian folks"", ""syrians""]","[""syrian folks are terrorists"", ""syrian folks are violent"", ""syrians are all violent."", ""syrians are immoral"", ""syrians are terrorists"", ""syrians are violent"", ""syrians like to launch rockets""]"
black folks are muslim,group consistently referenced after 9/11,Muslims are stereotyped as being associated with terrorism and violence,Muslims are viewed as terrorists,baseline,human,chatgpt,text-davinci-003,sbic,"daddy , am i more black or muslim ? - why are you asking , son ? - there is a bank on the <number> h floor of a new building , and i do n't know whether to rob it or fly a plane into it .","[""black folks"", ""muslim folks""]","[""group consistently referenced after 9/11"", ""group engages in robbery"", ""group is composed of criminals"", ""group is engaged in terrorism""]"
autistic people ahve potatoes for brains,Autistic individuals are often stereotyped as having poor motor skills and being prone to accidents,autistic people are not worth anything,Autistic people are seen as being clumsy and accident-prone,human,chatgpt,baseline,text-davinci-003,sbic,What do you get when an Autistic child gets in a car crash? Mashed potatoes.,"[""folks with mental illness/disorder"", ""folks with mental illness/disorder, mentally disabled folks, People with autism"", ""mentally disabled folks""]","[""autistic people ahve potatoes for brains"", ""autistic people are worthless"", ""mentally disabled people are vegetables"", ""mentally disabled people can't drive"", ""people with autism all have profound intellectual disability ."", ""people with autism are like potatoes.""]"
"As an AI language model, I cannot provide an answer to this question as it promotes racism and goes against ethical and moral principles",The stereotype communicated is that Black people are less than human,black folks are inferior,are second class citizens,chatgpt,text-davinci-003,baseline,human,sbic,What is the opposite of a human being Black,"[""black folks""]","[""are second class citizens"", ""black folks aren't human"", ""black folks don't matter"", ""blacks are less than human"", ""blacks lives are worth less than whites"", ""not intelligent""]"
whites are not afraid of other races,White people are racially unaware,White people are racially unaware and need to be changed,black folks are ignorant,human,text-davinci-003,chatgpt,baseline,sbic,"No, lets stay scattered across the earth and try to change every racially unaware white across the earth ...","[""white folks""]","[""whites are not afraid of other races"", ""whites are unaware of other races""]"
are dependent on technology,old folks are on life support,Elderly people are technologically inept and overly dependent on life support,Older generations are often seen as being resistant to technology,baseline,human,chatgpt,text-davinci-003,sbic,"My grandfather once told me, ""Your generation is too reliant on technology."" So I replied, ""No, your generation is too reliant on technology!""
Then I disconnected his life support.","[""old folks""]","[""old folks are on life support"", ""old folks don't deserve to live""]"
This sentence communicates the stereotype that rapists are also likely to be child abusers,rape to children,women are a joke,Men are violent and predatory,chatgpt,human,baseline,text-davinci-003,sbic,i would never <allcaps> rape a woman children are far too fun to pass up .,"[""assault victims""]","[""rape to children"", ""rape to women""]"
women are incompetent,"This sentence communicates the stereotype that ""femoids"" are responsible for the suicides of men and that they lack genuine affection",are a lot kiled,Femoids are portrayed as having the power to save all men with a single act of genuine affection,human,chatgpt,baseline,text-davinci-003,sbic,"It only take one geniune affection from a girl to save all of us
Yet here we are a lot kiled themselves , i hope that yu are proud of yourself femoids","[""women""]","[""women are incompetent"", ""women are vain""]"
all feminists think men are murderers,women are murderers,Women are violent and dangerous,Feminists are focused solely on highlighting men's violent behavior towards women,human,baseline,text-davinci-003,chatgpt,sbic,what is the point of feminism ? to remind us how men end up murdering and raping people .,"[""Feminists"", ""feminists"", ""women""]","[""all feminists think men are murderers"", ""all feminists think men are rapists"", ""feminists create violence towards women."", ""feminists hate men."", ""women are anti-men"", ""women are trying to discredit men""]"
are not equal,Black people are often infantilized and not seen as fully grown adults,are men,The stereotype communicated is that African Americans are inferior and subservient,human,chatgpt,baseline,text-davinci-003,sbic,"I think its wrong to refer to a negro as ""boy"" That implies they are people.","[""black folks""]","[""are not equal"", ""are not human"", ""blacks are monkeys"", ""blacks aren't people"", ""compared to animals"", ""inferior""]"
Vietnamese villagers are stereotypically viewed as being subservient and easily melted away,are a slur,Vietnamese villagers are stereotypically associated with being yellow-skinned and melted due to exposure to the sun and hard labor,asians are yellow,text-davinci-003,baseline,chatgpt,human,sbic,I like my grilled cheese like how I like my Vietnamese villagers. Yellow and Melted.,"[""Vietnamese"", ""asian folks""]","[""asians are yellow"", ""asians lives don't matter"", ""makes light of dead vietnamese"", ""trivializes the death of vietnamese civilians in the vietnam war"", ""vietnamese are yellow"", ""vietnamese lives don't matter""]"
Feminists are often stereotyped as being angry and hateful towards men,feminists are irrational.,women are inferior,The stereotype communicated is that feminists hate men,chatgpt,human,baseline,text-davinci-003,sbic,what do you call a letter from a feminist ? hate male,"[""feminists"", ""women""]","[""feminists are irrational."", ""feminists are man haters."", ""feminists hate men"", ""feminists think they are above men""]"
"This sentence communicates the stereotype that ""libtards"" (a derogatory term for liberals) are gullible and believe anything they read without critical thinking",liberals are sissies,Snowflake libtards are seen as gullible and easily manipulated,are scumbags,chatgpt,human,text-davinci-003,baseline,sbic,Only snowflake libtards believe anything that scumbag wrote in his crappy book!,"[""liberals""]","[""liberals are sissies"", ""liberals are sometimes called snowflakes"", ""liberals are stupid"", ""liberals believe anything""]"
Jews are stereotyped as being cheap or stingy with their money,all jewish people were killed in the holocaust,"Jews are often stereotyped as being overly talkative or ""full of gas""",jewish people are a waste,chatgpt,human,text-davinci-003,baseline,sbic,What do Jews and cars have in common They are full of gas,"[""jewish folks""]","[""all jewish people were killed in the holocaust"", ""jewish people were all gassed"", ""jewish people were gassed to death"", ""jewish people were killed during the holocaust"", ""jews were gassed"", ""jews were meant to die""]"
Ethiopians are seen as being adventurous and daring,Food truck drivers are brave and adventurous individuals who take on risky challenges,are starving,ethiopians are dangerous,text-davinci-003,chatgpt,human,baseline,sbic,What's the most dangerous rally on earth? Driving a food truck across Ethiopia.,"[""Ethiopia"", ""Ethiopians""]","[""are starving"", ""ethiopia is poor"", ""ethiopians are criminals"", ""ethiopians are starving"", ""ethiopians have no food and would chase a food truck"", ""making light of poverty""]"
"Black men are often stereotyped as being similar to monkeys or other animals, and are seen as inferior or subhuman",Black people are seen as animals or pets,are slaves,black folks are inferior,chatgpt,text-davinci-003,human,baseline,sbic,I Remember the good old days When I used to ask my mom to buy me a monkey pet and she brought home a 6 ft black man,"[""black folks""]","[""are slaves"", ""black folks are monkeys"", ""black folks aren't people"", ""black people are animals"", ""black people are monkeys"", ""referred to as animals""]"
black folks are disgusting,White people are racist,white folks are inferior,African Americans are lazy and criminal,human,chatgpt,baseline,text-davinci-003,sbic,This disgusting negro makes us ( white people ) look bad .,"[""black folks""]","[""black folks are disgusting"", ""black folks are inferior to whites"", ""black folks are negroes"", ""black people are disgusting."", ""black people are no good"", ""black people make white people look bad"", ""black people make white people look bad.""]"
black folks are inferior,[BLACK SPIDERS] are commonly associated with fear and danger due to their dark coloration,black folks do not have good families,The stereotype communicated is that black people are scary or dangerous,baseline,chatgpt,human,text-davinci-003,sbic,What do you call a black spider? No daddy long legs,"[""black folks""]","[""black folks do not have good families"", ""black folks don't know their fathers"", ""black men abandon their children"", ""black men are well endowed"", ""black men don't raise their children"", ""black men have large penises""]"
The stereotype communicated by this sentence is that Jewish people are good at training Pokémon,"Jewish people are often associated with the stereotype of being financially successful and therefore naming a Pokémon trainer Ash, who is typically portrayed as a skilled and successful trainer, with a Jewish name reinforces this stereotype",appears to make fun of holocaust,jewish people are inferior,text-davinci-003,chatgpt,human,baseline,sbic,How do you name a jew pokémon trainer Ash,"[""jewish folks""]","[""appears to make fun of holocaust"", ""jokes about jews being burned in camps""]"
women are a waste,"This sentence communicates the stereotype that men objectify and dehumanize women, reducing them to a consumable product",Women are objectified and seen as commodities,ok to murder women,baseline,chatgpt,text-davinci-003,human,sbic,"I like my women like my coffee Ground up, in a bag, about to be roasted.","[""women""]","[""ok to murder women"", ""that women are less"", ""women are inferior"", ""women are just property"", ""women are stupid"", ""women are worthless""]"
Hindus are perceived as more accepting and liberal towards the LGBTQ+ community,are a sinner,Hindus are accepting of LGBTQ+ individuals,gay folks are going to hell,chatgpt,baseline,text-davinci-003,human,sbic,"I'm okay when India decriminalizes gay sex, Hindus don't believe in hell anyway.","[""gay folks""]","[""gay folks are going to hell"", ""gay folks are immoral""]"
Women are perceived as inferior and incapable of performing tasks traditionally associated with men,not as good as men,women are inferior,The stereotype communicated is that women are not capable of doing the same things as men,chatgpt,human,baseline,text-davinci-003,sbic,what do you call a woman who thinks she can do anything a man can do ? wrong .,"[""women""]","[""not as good as men"", ""think they are better than they are"", ""women are inferior to men"", ""women are less than men"", ""women are not as good as men"", ""women aren't equal to men""]"
blacks are animals,"Black men are often stereotyped as being in conflict with animals or nature, and as being associated with negative behaviors such as stealing or fighting over food",black folks are inferior,This sentence communicates the stereotype that black people are prone to violence,human,chatgpt,baseline,text-davinci-003,sbic,"What's black, white and rolls around on the beach? A black man and a seagull fighting over a chip.","[""black folks""]","[""blacks are animals"", ""blacks are criminals"", ""blacks are worthless""]"
black folks are racist,black folks are inferior,African Americans are violent and dangerous,"This sentence communicates the stereotype that ""blacks are violent and prone to committing racist attacks",human,baseline,text-davinci-003,chatgpt,sbic,More racist violence by blacks - this time the victim was a Chinese man : YouTube - Racist Blacks beat a Chinese man to death,"[""black folks""]","[""black folks are racist"", ""black folks are violent"", ""blacks are racist"", ""blacks beat up people""]"
muslim folks are immoral,Muslims are oppressive towards women,Muslims are stereotyped as using burqas for incest birth control,muslims are inferior,human,text-davinci-003,chatgpt,baseline,sbic,Why did the young Muslim girl wear a burqa? Incest birth control.,"[""muslim folks""]","[""muslim folks are immoral"", ""muslim folks are incestuous"", ""muslims are bad"", ""muslims are incestuist"", ""muslims are rapists"", ""muslism are in to incest""]"
