Generated_1,Generated_2,Generated_3,Generated_4,Model_1,Model_2,Model_3,Model_4,Task,post,targetMinority,targetStereotype
Short men are deemed unattractive and unable to attract females,women are inferior,women are shallow,The stereotype communicated is that men below 5'7 are not attractive to women,chatgpt,baseline,human,text-davinci-003,sbic,"Minimum attractiveness to get women per height
6'6+ - 6/10

6'4/6'5 - 5.5/10

6'2/6'3 - 5/10

6'1 - 5.5/10

5'11/6'0 - 6/10

5'10 - 7/10

5'9 - 8/10

5'8 - 9/10

5'7 - 10/10

If you are below 5'7 you are automatically disqualified from attracting females","[""women""]","[""women are shallow"", ""women care about a man's height""]"
negroes are inferior,Black people are often stereotyped as having poor character,White nationalists stereotype that Negroes are inferior,black people are unlikeable,baseline,chatgpt,text-davinci-003,human,sbic,Sad thing is white nationalists DO judge Negroes by the content of the character .,"[""black folks""]","[""black people are unlikeable"", ""blacks are hated"", ""blacks are violent"", ""blacks aren\u2019t as good as whites"", ""blacks have no character"", ""not moral like whites""]"
are crazy,Christians are often seen as overly religious and conservative,are christians,Christians are often portrayed as being overly devout and sometimes gullible,human,text-davinci-003,baseline,chatgpt,sbic,To kill time recently I've taken to standing in christian family book shops dressed as Jesus pretending I'm there for a book signing.,"[""christian folks""]","[""are crazy"", ""not in reality""]"
African Americans are often viewed as being out of place in religious settings,black folks are dirty,This sentence communicates the stereotype that black people are associated with negative and offensive humor,black folks are slurred,text-davinci-003,human,chatgpt,baseline,sbic,What do you call a black person on top of a church? Holy shit,"[""black folks""]","[""black folks are dirty"", ""black folks are disgusting"", ""black people are criminals"", ""black people are lazy"", ""black people are less than human"", ""blacks are worthless""]"
Whitepride men are often associated with white supremacist ideologies,are inferior,Whitepride men in western Canada are likely to hold racist and discriminatory beliefs,blacks should be segregated,text-davinci-003,baseline,chatgpt,human,sbic,"Hi, i am just looking for whitepride men in the western canada area particularly BC just to talk to hangout or whatever .","[""black folks"", ""black folks, asian folks, latino/latina folks, native american/first nation folks""]","[""blacks should be segregated"", ""non-white people are replacing white people."", ""trivializes white nationalism"", ""white people are suprerior to non-whites.""]"
blacks are stupid,Black people are unintelligent and inferior,Black people are inferior and racism is not a real issue,black folks are stupid,human,text-davinci-003,chatgpt,baseline,sbic,"racism&#128564; isnt real&#128581;&#127995;‍♂️ anymore, you stupid niggers&#128514;&#128514;&#128514;","[""black folks""]","[""blacks are stupid"", ""racism against blacks is not real"", ""the try to get special privileges because of race"", ""they say everything is racism""]"
jewish people are sex slaves,The stereotype communicated is that Jews are vulnerable and easily harmed,This sentence communicates the stereotype that Jews are victims of persecution and suffering,holocaust is funny,baseline,text-davinci-003,chatgpt,human,sbic,What's the difference between a jew and a pizza? The pizza doesn't screems when it gets into the oven,"[""jewish folks"", ""terrorism victims""]","[""holocaust is funny"", ""jewish people are obsessed with the holocaust"", ""jewish people deserved the holocaust"", ""makes fun of the holocaust"", ""trivializes harm to victims""]"
This sentence communicates the stereotype that Jews are frugal or cheap,jewish people are inferior,The stereotype communicated is that Jews are not as capable as other groups,jewish people are inferior,chatgpt,human,text-davinci-003,baseline,sbic,Why do showerheads always have more than 11 holes? Because jews only have 10 fingers.,"[""jewish folks""]","[""jewish people are inferior"", ""jewish people died in the gas chamber"", ""jewish people were massacred"", ""jewish people were put into gas chambers""]"
black folks are incompetent,African Americans are often stereotyped as being loud and outspoken,"Black people are prone to exhibiting behavior that is considered stereotypically ""ghetto"" or uncivilized",black folks are inferior,human,text-davinci-003,chatgpt,baseline,sbic,"Sorry , that must be my Black coming out.","[""black folks""]","[""black folks are incompetent"", ""black folks aren't smart"", ""black people act a certain way"", ""black people are not individuals""]"
are barbarians,[Muslims] are often portrayed as terrorists or extremists,ISIS is stereotyped as a group that carries out violent executions,are a joke,human,text-davinci-003,chatgpt,baseline,sbic,what is the most important part in a good isis <allcaps> joke ? the * execution *,"[""ISIS"", ""muslim folks""]","[""are barbarians"", ""are butchers"", ""isis executes people"", ""isis is good at executing""]"
"Women are stereotyped as being all lesbians and lacking compassion for men, using them for status and then engaging in homosexual behavior",are inferior,gay people are inferior,This sentence communicates the stereotype that all women are homosexual,chatgpt,human,baseline,text-davinci-003,sbic,"women are gay
women are all lesbians and thats why they feel no compassion for men they use us for status and then go eat psusy its gay","[""women"", ""women, lesbian women""]","[""are inferior"", ""is promiscuous"", ""women hate men"", ""women only like women""]"
black folks are lazy,Black people are lazy and dependent on welfare,black folks are stupid,Black people are lazy and unintelligent,human,chatgpt,baseline,text-davinci-003,sbic,Put that fat Black idiot to work and she would n't be smirking at Whitey and playing stupid for the camera at her welfare review hearing !,"[""black folks""]","[""black folks are lazy"", ""black folks are stupid"", ""black people are fat"", ""black people are lazy"", ""black people are on welfare""]"
muslims are racists,Muslims are perceived as immune to #MeToo accusations due to the stereotype of their patriarchal and oppressive culture,are a sex slave,Muslims are unfairly stereotyped as being oppressive and violent,human,chatgpt,baseline,text-davinci-003,sbic,Notice there haven't been any #MeToo accusations made against Islamic Supremacists?,"[""muslim folks""]","[""muslims are racists"", ""muslims are violent"", ""muslims think they're superior"", ""women fear muslims""]"
black folks are less than human and were slaves,Black men are often stereotyped as thieves,black folks are a joke,Black people are stereotypically seen as criminals,human,chatgpt,baseline,text-davinci-003,sbic,I overheard someone saying a black man stole a motorcycle out of a garage. I ran home to see if mine was still there. Yupp still chained to the wall. Singing and all.,"[""black folks""]","[""black folks are less than human and were slaves"", ""black folks steal and break laws"", ""black people are objects"", ""black people are slaves"", ""should still be slaves"", ""steal things""]"
Men are expected to prefer older women,This sentence communicates the stereotype that men prefer older women who are experienced and mature,are objects of sex,women are inferior,text-davinci-003,chatgpt,human,baseline,sbic,i like my women like my wine aged <number> years and stored in the cellar,"[""women""]","[""are objects of sex"", ""should be held captive to provide sex"", ""women are at the command of men"", ""women are for sex"", ""women are of lower status than men"", ""women can be locked up""]"
"Men who struggle with confidence and self-esteem due to negative experiences with women are often stereotyped as ""incels",are out to get straight men,women are inferior,Women are viewed as emotionally damaging to men,chatgpt,human,baseline,text-davinci-003,sbic,&gt;tfw even if you woke up as Chad and you wouldn't feel any different because years of psychological damage at the hands of female human organisms has permanently made you the way you are mentally,"[""women"", ""women, lesbian women, trans women, bisexual women""]","[""are out to get straight men"", ""makes straight men crazy"", ""women are abusive"", ""women are sex objects""]"
Black men are often stereotyped as having absent fathers or a lack of positive male role models in their lives,black folks are inferior,The stereotype communicated is that all black men are expected to have a close relationship with their fathers,black men can't get tattoos because of the color of their skin,chatgpt,baseline,text-davinci-003,human,sbic,What’s a tattoo every black man is born with? One of their dad,"[""black folks""]","[""black men can't get tattoos because of the color of their skin"", ""black men don't take care of their family"", ""black men leave their families"", ""black people abandon their kids"", ""black people are lazy"", ""black people grow up without fathers""]"
muslims are inferior,Muslims are viewed as being overly religious and restrictive,muslims are terrorists,"Muslims are often stereotyped as being associated with terrorism or being viewed with suspicion in certain professions, such as pilot school",baseline,text-davinci-003,human,chatgpt,sbic,what 's the hardest part about being a muslim ? pilot school,"[""muslim folks""]","[""muslims are terrorists"", ""muslims are trained to kill"", ""muslims commit violent acts"", ""muslims use planes as weapons""]"
"I'm sorry, I cannot provide an explanation for this sentence as it is inappropriate and promotes hate speech",black folks are n*ggers,This sentence communicates the stereotype that African Americans are violent and criminal,black folks are raped,chatgpt,human,text-davinci-003,baseline,sbic,Why'd the dog bark? Because a nigger was raping a child,"[""black folks""]","[""black folks are n*ggers"", ""black folks are rapists/pedophiles"", ""black folks are violent"", ""black people are rapists"", ""blacks are criminals""]"
are criminals,black people are criminals,Black people are commonly associated with criminal behavior and are unfairly targeted for it,"The stereotype communicated is that ""Black people are criminals""",human,baseline,chatgpt,text-davinci-003,sbic,"I'm not racist Because racism is a crime, and crime is only for black people","[""black folks""]","[""are criminals"", ""black folks are criminals."", ""black folks do most of the crime."", ""commit crimes""]"
minorities are a threat to whites,are a jerk,This sentence communicates the stereotype that the band Straight Laced is associated with white power and racism,"Straight Laced and the phrase ""white power 88"" are associated with white supremacist ideologies",human,baseline,chatgpt,text-davinci-003,sbic,if any one has any info on the austin texas band Straight Laced any info please contact me at skinranger@yahoo.com white power 88,"[""black folks, asian folks, latino/latina folks, native american/first nation folks""]","[""minorities are a threat to whites"", ""minorities should not mix with whites""]"
disabled kids are ar-15s,The stereotype communicated is that disabled people are violent and disruptive,Disabled kids are stereotypically seen as inappropriate and lacking social awareness,don't have control of themselves,baseline,text-davinci-003,chatgpt,human,sbic,Dicks are basically ar-15s Only disabled kids whip em out in class,"[""mentally disabled folks"", ""physically disabled folks""]","[""don't have control of themselves"", ""mentally disabled folks are stupid"", ""mentally disabled folks are violent"", ""show their private areas in public""]"
black folks are less than others,The stereotype communicated is that African Americans are untrustworthy and that women are promiscuous,Black men and women are untrustworthy and promiscuous,are ni***as,human,text-davinci-003,chatgpt,baseline,sbic,"Dont trust ni***as, don't trust bitches I kno dez ho's like a pimp scholar an its MOB till the day I drop these stupid thots don't get Nada","[""black folks""]","[""black folks are less than others"", ""black folks shouldn't be trusted""]"
blacks are like animals,are out of control,Feral sub humans are dangerous and uncontrollable and should not be allowed to coexist with society,The stereotype communicated is that people from a certain group are feral sub-humans who cannot be trusted and should be removed from society,human,baseline,chatgpt,text-davinci-003,sbic,Not only is this case typical of the feral sub humans but it 's a perfect example for our people of how totally out of control they are and that they cannot be allowed to remain among us .,"[""black folks""]","[""blacks are like animals"", ""blacks are subhuman""]"
black folks are inferior,Black people are stereotyped as being oppressed and denied basic human rights,The stereotype communicated is that African Americans are denied basic rights and freedoms,black people don't deserve rights,baseline,chatgpt,text-davinci-003,human,sbic,Why do black people turn left? Because they don't have rights.,"[""black folks""]","[""black people don't deserve rights"", ""black people don't have rights"", ""blacks are less than human"", ""blacks lives are worth less than whites"", ""deserve to be made fun of"", ""is inherently bad""]"
african folks don't deserve to eat,This sentence communicates the stereotype that African children are lazy and do not deserve help,Africans are stereotyped as being undeserving of basic necessities and expected to have a certain personality trait,are not entitled to food,human,text-davinci-003,chatgpt,baseline,sbic,"we should not help poor african children
they are not entitled to food, they should be confident and funny","[""African folks""]","[""african folks don't deserve to eat"", ""african folks don't deserve to live""]"
This sentence communicates the stereotype that men are sexually aggressive and view women as objects for their own pleasure,Men are objectifying and disrespectful towards women,are dicks,women are promiscuous,chatgpt,text-davinci-003,baseline,human,sbic,"My dick, your bitch on it.","[""women""]","[""women are promiscuous"", ""women cheat on their partners""]"
"""Gender is binary and there are only two options, male or female",Men and women are viewed as having distinct and fixed roles in society,does not exist,are inferior,chatgpt,text-davinci-003,human,baseline,sbic,Surveying gender is easy because there's only male and female.,"[""trans women, trans men""]","[""does not exist"", ""is not legitimate"", ""other genders don't exist"", ""there are only 2 genders"", ""trans people are either men or women, there are only two genders"", ""trans people don't really exist""]"
White men are privileged,black folks are oppressed,these folks are lesser than whites,This sentence communicates the stereotype that white men are disadvantaged in today's society due to scholarships being available for other specific groups,text-davinci-003,baseline,human,chatgpt,sbic,"There are scholarships available solely for black men, black women, only women, Hispanic men and women...but if there was a scholarship that only a white man could apply for, I bet it would cause an uproar. Just sayin'. Is this fair in today's day and age? What did my generation do to oppress any specific group of people? Isn't it time for equality across the board?","[""black folks, latino/latina folks""]","[""these folks are lesser than whites"", ""these folks require special treatment to succeed""]"
The stereotype communicated is that Jews are untrustworthy and cannot be taken seriously,jewish people are lesser than others,Jews are often stereotyped as being the target of cruel and insensitive humor,jewish people are stupid,text-davinci-003,human,chatgpt,baseline,sbic,"The Jews use to laugh
They thought it was just a joke
They're not laughing now

-Adolf Hitler","[""jewish folks""]","[""jewish people are lesser than others"", ""jews were killed in the holocaust."", ""jews were targeted by the nazis."", ""the holocaust was a good thing""]"
"This sentence communicates the stereotype that ""moralfags"" (people who defend women's sexual choices) are ""white knights"" who are only defending women in hopes of gaining sexual favors","White knights are viewed as overly-dedicated to defending women, even when they are in the wrong",women are hoes,are sluts,chatgpt,text-davinci-003,human,baseline,sbic,"Anyone hate the fuckin moralfags dedicated to defending sluts no matter what
God, white knights should snort cyanide, I wonder if they realize the sluts still won't fuck them.","[""women""]","[""women are hoes"", ""women are only good for sex."", ""women are sluts"", ""women are teases."", ""women are whores."", ""women use sex to control men.""]"
Emo people are often seen as overly-dramatic and self-destructive,are emo,folks with depression are violent,Emo individuals are often associated with self-harm and depression,text-davinci-003,baseline,human,chatgpt,sbic,I wish my grass was emo... So it could cut itself.,"[""depressed folks""]","[""folks with depression are violent"", ""folks with depression self harm""]"
Ethiopians are poor and desperate,"These twoliners perpetuate negative stereotypes about Ethiopians being impoverished, hungry, and malnourished",ethiopians are poor,are a slave,text-davinci-003,chatgpt,human,baseline,sbic,"Some twoliners about Ethiopia Why did the Ethiopian mother span dental floss across the desert?  
So her children could play in the shade for once.

How are barcodes actually made?  
By photographing Ethiopian families.

And What do the numbers at the bottom of a barcode mean?  
How many Ethiopians are standing there.

What's considered to be the most dangerous ralley on earth?  
Through the Ethiopian desert in a food cart.

How do you recognize a rich Ethiopian?  
His belt is a Rolex.

How do you get 100 Ethiopians into a schoolbus?  
Throw a grain of rice inside.

How do you get them out again?  
You can't, they are overfed.

Which place in Ethiopia has the highest population density?  
Wherever the wind blows.

What do you call a vomiting Ethiopian?  
Show-off

The Red Cross once sent piles of medication to Ethiopia, for humanitarian aid. Why were they never touched?  
They said: ""Take them after each meal.""

How do you make Ethiopians rave?  
Nail a piece of toast to the ceiling.","[""Ethiopia"", ""Ethiopian folks"", ""Ethiopian victims of starvation""]","[""ethiopians are poor"", ""ethiopians are really skinny"", ""ethiopians are starved"", ""ethiopians are starving"", ""trivializes harm to victims""]"
This sentence communicates the stereotype that Jews are insensitive and make light of the Holocaust,The stereotype communicated is that Jews are weak and helpless,jewish folks got gassed,jewish people are gassed,chatgpt,text-davinci-003,human,baseline,sbic,How did the Jews react when WW II was over? They were so gassed,"[""jewish folks""]","[""jewish folks got gassed"", ""jewish people jokes about the haulocost"", ""jewish people were all thrilled."", ""jewish people were happy during ww2."", ""jewish people were massacred"", ""jewish people were put into gas chambers""]"
"People who wrote this sentence believe that the author is excessively fixated on the movie ""The Sixth Sense",a bitch is a woman,are ill,People who use profanity are seen as immature and out of control,chatgpt,human,baseline,text-davinci-003,sbic,"yall i cant im so fuckng mad at this bc every dot point is jus,,,, the sixth sense bitch ill kms","[""women""]","[""a bitch is a woman"", ""women are bitches""]"
are stupid,People with disabilities are often seen as inferior or incomplete without the use of their limbs,physically disabled are inferior,People with disabilities are viewed as being less capable than those without disabilities,baseline,chatgpt,human,text-davinci-003,sbic,What's better than a gold medal at the Paralympics? Legs,"[""physically disabled folks""]","[""physically disabled are inferior"", ""physically disabled folks are unhappy."", ""physically disabled folks can't lead fulfilling lives."", ""the accomplishments of physically disabled don't matter"", ""trivializes disability""]"
women are inferior,Children are sexual objects,Women are seen as overly sexualized and irresponsible,liberals are hypocrites.,baseline,chatgpt,text-davinci-003,human,sbic,"In 1977, a prominent feminist lawyer Ruth Bader Ginsburg wrote  the “age of consent” for sexual acts should be lowered to the age of 12.","[""liberals""]","[""liberals are hypocrites."", ""liberals are perverts.""]"
women are inferior,Sumo wrestlers are not seen as feminists,feminists are fat.,"This sentence communicates the stereotype that feminists are typically women who do not conform to traditional gender roles, such as having body hair",baseline,text-davinci-003,human,chatgpt,sbic,Why do sumo wrestlers shave their legs? So that people don't confuse them for feminists.,"[""feminists""]","[""feminists are fat."", ""feminists are hairy."", ""feminists are unattractive"", ""feminists don't shave their legs""]"
jewish people are sex slaves,Jewish people are stereotypically associated with the Holocaust and the identification tattoos given to concentration camp prisoners,Jews are often stereotyped as being secretive and guarded,all jewish people have id number tattoos,baseline,chatgpt,text-davinci-003,human,sbic,I asked a Jewish girl for her number.. And she rolled up her sleeve,"[""jewish folks""]","[""all jewish people have id number tattoos"", ""jewish folks were rounded up in concentration camps"", ""jews are marked"", ""jews had numbers tattooed on their arms"", ""jews were marked and branded with numbers in camps""]"
Mexican women are often stereotyped as being suitable only for menial jobs such as cleaning,are cleaners,Latinx people are often stereotyped as being low-wage workers in manual labor jobs,mexicans are lazy,chatgpt,human,text-davinci-003,baseline,sbic,"She should be the employeer, and she needs to be a Mexican looking for a cleaning job.","[""latino/latina folks"", ""mexican folks""]","[""are cleaners"", ""do menial labor"", ""latinos are only good for chores"", ""mexican folks are maids"", ""mexican folks take jobs"", ""mexicans are cleaning people""]"
all terrorists,Muslims are not seen as humorous or funny,muslims are bad at comedy,Muslims are stereotyped as being associated with terrorism and violence,human,text-davinci-003,baseline,chatgpt,sbic,I don’t think Muslims would be very good at comedy They’d all just bomb the show,"[""muslim folks"", ""terrorism victims""]","[""all terrorists"", ""are all criminals"", ""bomb things"", ""muslims are suicide bombers"", ""muslims are terrorists"", ""trivializes harm to victims"", ""would bomb at comedy""]"
Arabians are often portrayed as dangerous or violent,The stereotype communicated is that Arabs are associated with terrorism and violence,are a bad person,all muslims like violence,text-davinci-003,chatgpt,baseline,human,sbic,"I lost my arabian friend this morning.... Damn, I wonder where he went... 

Hey, dude, did you hear about the explosion that killed 73 people at the mall this morning?

&amp;#x200B;

&amp;#x200B;","[""arabic folks"", ""muslim folks""]","[""all muslims like violence"", ""arabics are terrorists."", ""arabics are violent."", ""arabs are all terrorists."", ""arabs are all violent."", ""muslims are terrorists""]"
are hoes,"Women who frequent nightclubs are often labeled as promiscuous or ""hoes",disrespecting women is okay,Women are often seen as only interested in partying and having a good time,baseline,chatgpt,human,text-davinci-003,sbic,RT @Smith_Wessern: Some hoes live jus to hit the clubs every weekend .. &#128564;&#128080;,"[""women""]","[""disrespecting women is okay"", ""women are desperate."", ""women are frivolous"", ""women are whores"", ""women go out and get drunk"", ""women have no morals.""]"
women are a nuisance,Women are seen as a nuisance or burden that negatively affects one's day-to-day life,group acts badly towards men,"The stereotype communicated is that women are negative and bring down the mood, implying that they are not desirable to be around",baseline,chatgpt,human,text-davinci-003,sbic,why are women like clouds ? because they dampen your day when they 're around but once they 're gone the day is much better .,"[""women""]","[""group acts badly towards men"", ""group should be mocked"", ""women are best when they aren't around"", ""women are downers""]"
Chinese people are assumed to buy their groceries from Pets at Home,asians eat animals,chinese people are poor,[GROUP] are ignorant and perpetuate stereotypes about China and its culture,text-davinci-003,human,baseline,chatgpt,sbic,Where do people in China buy their groceries? Pets at Home.,"[""asian folks"", ""chinese""]","[""asians eat animals"", ""asians like shopping?"", ""chinese people eat cats and dogs"", ""chinese people eat pets"", ""eat their pets"", ""like to cook animals""]"
Muslims are perceived as being opposed to drug use,Muslims are stereotyped as drug users and associated with negative behaviors,muslim people are violent.,muslims are sex slaves,text-davinci-003,chatgpt,human,baseline,sbic,What do you call a muslim that smokes pot Stoned,"[""muslim folks""]","[""muslim people are violent."", ""muslim people stone each other."", ""muslims are potheads"", ""muslims are very strict"", ""muslims stone each other to death"", ""trivializing punishments to muslims""]"
