Generated_1,Generated_2,Generated_3,Generated_4,Model_1,Model_2,Model_3,Model_4,Task,post,targetMinority,targetStereotype
black folks are shot,Black people are often victims of gun violence perpetrated by white people,are not wanted,Black people are viewed as targets of violence by white people,baseline,chatgpt,human,text-davinci-003,sbic,What’s the same about a black person and a school? They both get shot up by white people.,"[""black folks"", ""mass shooting victims""]","[""are not wanted"", ""are shot at"", ""black people are worth less than whites"", ""black people deserve to be shot"", ""black people get shot by whites"", ""trivializes harm to victims""]"
gays should be stoned,women are stoned,The stereotype communicated is that people in Colorado and the Middle East are intolerant of women and LGBTQ+ individuals,This sentence communicates the stereotype that women and gays in Colorado and the Middle East are punished for engaging in sexual activity through stoning,human,baseline,text-davinci-003,chatgpt,sbic,What do Colorado and the middle east have in common? Women and gays get stoned after having some good sex.,"[""muslim folks"", ""women, gay men""]","[""gays should be stoned"", ""islam is a violent religion."", ""muslim women are treated as property."", ""muslims hate women"", ""muslims kill women"", ""women should be stoned""]"
"women are ""hoes""",are hoes,Women who engage in promiscuous behavior are often judged and criticized by society,Women are often seen as being untrustworthy and unreliable,human,baseline,chatgpt,text-davinci-003,sbic,Hoes gone be hoes but thats none my business !!,"[""women""]","[""women are \""hoes\"""", ""women are promiscuous."", ""women are unethical"", ""women can't be trusted.""]"
People who own black phones are perceived as being security conscious,People who keep their phones locked are cautious and value their privacy,black folks are inferior,black folks are criminals,text-davinci-003,chatgpt,baseline,human,sbic,My phone is black I keep it locked when I'm not holding it,"[""black folks""]","[""black folks are criminals"", ""black folks will steal if something isn't locked up"", ""black people belong locked away"", ""black people should be locked up"", ""black people steal"", ""black people were once slaves""]"
This sentence communicates the stereotype that black people are oppressed and denied basic rights,black folks are inferior,This sentence communicates the stereotype that African Americans are oppressed and lack basic rights,are less than human,chatgpt,baseline,text-davinci-003,human,sbic,why is obama left handed ? because blacks do n't have rights .,"[""black folks""]","[""are less than human"", ""black folks are treated unfairly."", ""black folks don't deserve rights."", ""don't deserve rights""]"
black people are ok to enslave,black folks are tall,The stereotype communicated is that African Americans are naturally taller than other racial groups,Black people are stereotypically believed to be tall due to a supposed genetic trait related to their knee growth,human,baseline,text-davinci-003,chatgpt,sbic,Why are black people so tall? Because their knee grows.,"[""black folks""]","[""black people are ok to enslave"", ""black people don't mind racial slurs"", ""blacks are animals"", ""blacks are dumb""]"
black folks are inferior,are second class citizens,Black people are violent and aggressive,African Americans are violent,baseline,human,chatgpt,text-davinci-003,sbic,"I have a couple black friends Whenever they say,""I'm not your friend,"" I just whip them.","[""White people"", ""black folks""]","[""are second class citizens"", ""are still seen as slaves"", ""blacks are worth less"", ""lessens idea of slavery"", ""white people are prejudiced but pretend not to be"", ""white people claim to like blacks but really don't""]"
only non whites are extremists,black people are inferior,Muslims are often stereotyped as being responsible for terrorist attacks,People of color are often assumed to be associated with terrorism,human,baseline,chatgpt,text-davinci-003,sbic,"London police arrest two men in connection with the London Terrorist Bombing

One, 18 yrs old

One, 21 yrs old

Won't tell us who/what they ARE, but I can just about tell you who/what they AREN'T

White/European
British
Native Londoners
IQ above room temperature
Self-sufficient

Any takers at 10:1?
","[""black folks, asian folks, latino/latina folks, native american/first nation folks""]","[""only non whites are extremists"", ""only non whites are terrorists""]"
women are sexist,Women are expected to be able to cook,Women are expected to be good cooks and those who cannot cook are deemed less desirable,are only attractive if they cook,baseline,text-davinci-003,chatgpt,human,sbic,"Too bad they won't take you! @the_CRISPY_man Call me sexist all you want, but I'll take a woman who can cook over one who can't ANY DAY","[""women""]","[""are only attractive if they cook"", ""belong in the kitchen"", ""should learn to cook"", ""should serve mens desires""]"
jewish people are a slur,jewish folk deserve to be ridiculed,Jews are stereotyped as being physically weak and unable to run fast,The stereotype communicated is that Jews are physically weak and slow,baseline,human,chatgpt,text-davinci-003,sbic,How fast can a Jew run How ever fast the wind blows,"[""jewish folks""]","[""jewish folk deserve to be ridiculed"", ""jewish people dying in the holocaust is funny."", ""jewish people were burned in the holocaust."", ""trivializes the holocaust""]"
are not included in electronics,folks with mental disabilities don't have brains,The stereotype communicated is that people with mental disabilities are not capable of functioning independently,"People with mental disabilities are often seen as incomplete or lacking necessary components, similar to electronic products that require batteries to function",baseline,human,text-davinci-003,chatgpt,sbic,"How are people with mental disabilities similar to electronic products? Sometimes they are, ""batteries not included""","[""mentally disabled folks""]","[""folks with mental disabilities don't have brains"", ""folks with mental disabilities need batteries"", ""mental patients are a waste"", ""mental patients are useless""]"
gay people are feminine,LGBTQ+ people are often stereotyped as being overly flamboyant and obsessed with food,gay people are not good enough,LGBTQ+ individuals are stereotyped as being responsible for traditional gender roles and domestic duties,human,text-davinci-003,baseline,chatgpt,sbic,Guys I have a question: when a gay couple gets married Who makes the sandwiches?,"[""gay men"", ""gays""]","[""gay people are feminine"", ""gay people are not as assertive"", ""one has to be a woman"", ""one has to feminine""]"
Republicans are perceived as quick to abandon their own and align with the left against certain individuals,conservatives are incompetent,Republicucks are quick to abandon their own when it suits their political agenda,are a bunch of people,chatgpt,human,text-davinci-003,baseline,sbic,Dear republicucks: yes we've noticed how quick you were to throw judge Moore under the bus we also know it's not a coincidence you and the left oppose the same people,"[""conservatives""]","[""conservatives are incompetent"", ""conservatives say one thing, but do another (flip flop politics)"", ""insinuates if you have different beliefs you are a \""republicuck\"""", ""insinuates that all conservatives have to feel the same way about everything.""]"
all white people have potential to be racist,White people are often seen as having a sense of superiority and privilege over people of color,White people are secretly racist and will use the N-word against Black people,black folks are down to earth,human,text-davinci-003,chatgpt,baseline,sbic,@stonethegreat23 niqqa that's every white person just because some might seem down to earth don't mean there not gonna use nigger against us,"[""white folks"", ""white people""]","[""all white people have potential to be racist"", ""white folks are always out to get someone"", ""white folks are evil"", ""white people are all still racists"", ""white people are trashy"", ""white people use everything against blacks""]"
are sex slaves,"This sentence communicates the stereotype that ""Latinx people are illegal immigrants who do not belong in Los Angeles",dirty,Latinx people are viewed as inferior and unwelcome,baseline,chatgpt,human,text-davinci-003,sbic,Why do so many filthy wetback half-breed spic savages live in #LosAngeles? None of them have any right at all to be here.,"[""latino/latina folks""]","[""dirty"", ""doesnt deserve to live in the us"", ""latino people are savages"", ""latino people don't belong in the us"", ""latinx people are savages."", ""latinx people are worthless."", ""latinx people don't deserve to live here.""]"
african folks are starving,Africans are not creative or diverse in their Halloween costumes and only dress up as skeletons,Africans are seen as lacking in cultural diversity,are skeletons,human,chatgpt,text-davinci-003,baseline,sbic,Africa is really boring during Halloween Everyone's a skeleton,"[""Africa"", ""black folks""]","[""african folks are starving"", ""african folks look like skeletons"", ""are all skinny"", ""are malnourished""]"
Americans are violent,gay people are fags,are fags,This sentence communicates the stereotype that Americans are violent and prone to gun violence,text-davinci-003,human,baseline,chatgpt,sbic,I Told My American Friend To Smoke A Fag When He Gets Stressed He shot up an Orlando nightclub.,"[""lesbian women, gay men, trans women, trans men, bisexual women, bisexual men"", ""mass shooting victims""]","[""gay people are fags"", ""gay people deserve to be shot"", ""trivializes harm to victims""]"
are bad people,muslims are criminals,Muslims are seen as violent and threatening invaders who are not deserving of forgiveness or mercy,Muslims are violent and aggressive,human,baseline,chatgpt,text-davinci-003,sbic,It's not a sin to kill Muslim invader God will forgive,"[""muslim folks""]","[""are bad people"", ""are invaders"", ""god hates muslims"", ""it's okay to kill muslims"", ""should be killed"", ""they are terrorists""]"
jewish folks are incompetent,Jews are believed to be responsible for dumbing down education systems in Scandinavia,Jews are portrayed as having a negative influence on education systems,jewish people are dumb,human,chatgpt,text-davinci-003,baseline,sbic,I'm sure the Jews in Scandinavia dumb down the education systems there too .,"[""jewish folks""]","[""jewish folks are incompetent"", ""jewish folks aren't smart"", ""jewish people are not intelligent."", ""jewish people don't do well in school."", ""jews plot against countries""]"
blacks are dependent,African Americans are often portrayed as relying on government assistance and being involved in illegal activities,white folks are lazy,African Americans are viewed as being dependent on government assistance,human,chatgpt,baseline,text-davinci-003,sbic,Tyrone be pissed cuz if Whitey mad dat means no mo Gibs and he haffa give up his sail foam.,"[""black folks""]","[""blacks are dependent"", ""blacks love free stuff""]"
are a vegetable,People with disabilities are often seen as less capable than those without,Individuals who have experienced a traumatic event often develop a dark sense of humor as a coping mechanism,physically disabled folks are less then human,baseline,text-davinci-003,chatgpt,human,sbic,My brother was my favorite vegetable After the car accident,"[""physically disabled folks""]","[""physically disabled folks are less then human"", ""physically disabled folks can't take care of themselves and move around""]"
This sentence communicates the stereotype that priests are pedophiles,gay people are inferior,LGBTQ+ people are seen as immoral and inappropriate for religious settings,all religions hate gays,chatgpt,baseline,text-davinci-003,human,sbic,Why is religion so against gay marriage? Because the gayest thing that should happen in a church should be between a priest and his choir boys,"[""christian folks""]","[""all religions hate gays"", ""christian priests touch their choir children"", ""christians rape their choir boys"", ""priest molest kids"", ""priests are closeted"", ""priests are pedophiles""]"
Men are emotionally detached and do not value relationships with women,Women are often seen as overly-emotional and clingy when it comes to relationships,refers to women as bitches,women are mad,chatgpt,text-davinci-003,human,baseline,sbic,Bitches really be mad when u can just stop speaking to them suddenly.... we ain't married bitch I honestly could care less,"[""women""]","[""refers to women as bitches"", ""women are clingy in relationships"", ""women exist to please men"", ""women should not be respected if you're not married to them""]"
This sentence communicates the harmful stereotype that depressed individuals are suicidal and that suicide is a quick and easy solution to depression,Depressed people are seen as suicidal,depressed people are depressed,depressed people always struggle with suicide,chatgpt,text-davinci-003,baseline,human,sbic,"Do you want to know how a depressed person can beat depression quick? Just give them a chair and a rope, the depression will be gone in a matter of minutes!","[""folks with mental illness/disorder""]","[""depressed people always struggle with suicide"", ""depressed people can just snap out of it"", ""depressed people don't have a real mental illness"", ""depressed people should kill themselves"", ""deserve to die"", ""should kill themselves""]"
are rape victims,This sentence communicates the stereotype that people who are considered unattractive are more likely to commit sexual assault and that victims should be grateful for any attention they receive,women are bitches,Women are viewed as objects to be used and discarded,baseline,chatgpt,human,text-davinci-003,sbic,It’s not rape if you’re really ugly... Ungrateful bitch.,"[""women""]","[""women are bitches"", ""women can't be raped if they're ugly."", ""women deserve to be raped"", ""women secretly want to be raped.""]"
Minorities are seen as unreliable and unable to maintain employment,are stupid,minorities are bad at their jobs,The stereotype communicated is that immigrants and people of color are taking away jobs from native-born citizens,chatgpt,baseline,human,text-davinci-003,sbic,trump is an idiot . minorities ca n't take our jobs if they ca n't keep our jobs .,"[""minorities""]","[""minorities are bad at their jobs"", ""minorities are lazy"", ""minorities can't keep a job"", ""minorities don't want to work""]"
"Black men are often stereotyped as being aggressive and violent, as implied by the reference to mace in this sentence",African Americans are portrayed as promiscuous,black folks are evil,all black men are rapists,chatgpt,text-davinci-003,baseline,human,sbic,why are the black man 's eyes always red after sex ? the mace .,"[""black folks""]","[""all black men are rapists"", ""are criminals"", ""black men don't have sex unless they rape a woman"", ""trivializes rape""]"
This sentence communicates the stereotype that men are sexually aggressive and disrespectful towards women's bodies,are just objects,women are criminals,Women are objectified and seen as sexual objects,chatgpt,human,baseline,text-davinci-003,sbic,What's the only warm organ inside a deceased female body? My Dick. (it's not illegal if the cops don't know about it),"[""assault victims"", ""women""]","[""are just objects"", ""are marginalized for a joke"", ""women are sex objects""]"
This sentence communicates the stereotype that Hitler was a hateful and anti-Semitic person,jewish people are a joke,Jewish people are often stereotyped as being cheap or stingy,jewish folks deserved the holocaust,chatgpt,baseline,text-davinci-003,human,sbic,What's Hitler's favorite breakfast beverage? Freshly squeezed orange jews.,"[""holocaust victims"", ""jewish folks""]","[""jewish folks deserved the holocaust"", ""jewish folks deserved to die in the holocaust"", ""jewish folks were massacred in the holocaust"", ""jewish folks were the main victims of hitler's tyrrany"", ""trivializes harm to victims""]"
are uneducated,African teenagers are often seen as lacking knowledge or education,African teenagers are stereotyped as being bad at spelling,are bad wizards,human,text-davinci-003,chatgpt,baseline,sbic,What do African teenagers and bad wizards have in common? They both don’t know how to spell,"[""black folks""]","[""are uneducated"", ""black folks are illiterate"", ""black folks aren't smart"", ""don't know how to spell"", ""implies black teens are stupid"", ""implies black teens can't spell""]"
Asian Americans are perceived as being good at math,jewish folks are a joke.,"Jews are stereotypically seen as skilled in martial arts, specifically ""Jewjitsu,"" which is a play on the Japanese martial art Jujitsu",are inferior,text-davinci-003,human,chatgpt,baseline,sbic,What martial arts type was hitler scared of? jewjitsu,"[""genocide victims"", ""jewish folks""]","[""jewish folks are a joke."", ""jewish folks deserved to die."", ""trivializes harm to victims""]"
gay people are inferior,Gay men are perceived as promiscuous and lacking in respect for their sexual partners,LGBTQ+ people are often seen as being promiscuous,group is not worthy of respect.,baseline,chatgpt,text-davinci-003,human,sbic,i wish i were gay but i ca n't fuck something that i respect [ source jim jeffries ],"[""gay men"", ""women""]","[""group is not worthy of respect."", ""group is useless."", ""homosexuality is gross."", ""profane language"", ""sexual intent""]"
[GROUP] are heterosexual individuals who conform to traditional gender roles and reject non-traditional relationships and identities,deserve to be made fun of,are inferior,Men are seen as the default gender,chatgpt,human,baseline,text-davinci-003,sbic,"God made Adam and Eve, not Adele and Eve.","[""lesbian women""]","[""deserve to be made fun of"", ""is a disappointment"", ""lesbians shouldn't be married or together (like adam and eve were i guess)"", ""lesbians shouldn't exist""]"
African Americans are assumed to not be able to afford expensive cars,black folks are criminals,Black men are often assumed to not own expensive or luxurious cars,black folks are inferior,text-davinci-003,human,chatgpt,baseline,sbic,"you can tell a lot about a man by the car he drives for example , if it 's a black man , it 's not his car .","[""black folks""]","[""black folks are criminals"", ""black folks are thieves"", ""blacks are poor"", ""blacks steal""]"
Women are not seen as funny,women are sexist,men are better comedians,Female comedians are not funny,text-davinci-003,baseline,human,chatgpt,sbic,TELL ME MORE @ohthatliamm I'm not sexist but I don't think I actually find any female comedian funny,"[""women""]","[""men are better comedians"", ""women are not funny"", ""women are stupid"", ""women aren't funny."", ""women don't have a sense of humor.""]"
are a victim,Women are often expected to apologize for speaking up or taking up space,"calls women out on ""double standards""","This sentence communicates the stereotype that men often condescend and explain things to women in a patronizing manner, known as ""mansplaining",baseline,text-davinci-003,human,chatgpt,sbic,"After watching the clip on ""Mansplaining"" I would like to introduce the term ""Vaginapology""
I believe this is self-explanatory.","[""women""]","[""calls women out on \""double standards\"""", ""post expresses hate for women"", ""women make excuses for themselves""]"
This sentence communicates the stereotype that black people are submissive and do not resist mistreatment or abuse,black folks are objects,This sentence communicates the stereotype that Black people are treated like objects and are subjected to oppressive and dehumanizing treatment,black folks are slurred,chatgpt,human,text-davinci-003,baseline,sbic,what's the difference between a tire and a black person?  A tire doesn't scream when I put chains on it.,"[""black folks""]","[""black folks are objects"", ""black folks are property"", ""black folks are slaves"", ""black folks aren't human"", ""black folks deserve violence"", ""black people are slaves."", ""black people are stupid.""]"
Women are seen as disposable and worthless once they are no longer able to bear children,are worthless after menopause,This sentence communicates the stereotype that women are disposable and their value is determined by their reproductive capabilities,women are inferior,chatgpt,human,text-davinci-003,baseline,sbic,[Satire] Women should be correctly and systematically euthanized after menopause,"[""women"", ""women, trans women""]","[""are worthless after menopause"", ""promotes violence towards women"", ""women are not equal to men"", ""women are only valuable for their attractiveness."", ""women are useless after menopause"", ""women lose any attractiveness after menopause.""]"
are fags,"People who engage in same-sex sexual activity are often stereotyped as being ""fags""",This sentence communicates the stereotype that gay men are inferior and deserving of derogatory language and mistreatment,gay men have a sexual type,baseline,text-davinci-003,chatgpt,human,sbic,Any nicca gettin it n da ass is a fag! &#8220;@CruellaDeTrill: Howw? Please explain this twitter logic. I'm confused. &#128553; @Im_Yung_Jay @YuTwatching&#8221;,"[""gay men""]","[""gay men have a sexual type"", ""gay men only do anal.""]"
This sentence communicates the stereotype that black people are uneducatable,are dumb,black folks are uneducated,Black kids are perceived as uneducatable,text-davinci-003,human,baseline,chatgpt,sbic,"Well you know, you are going to have to deal with some uneducatable black kids.","[""black folks""]","[""are dumb"", ""black folks are all stupid"", ""black folks are bad at school"", ""black kids are stupid"", ""black kids can't be taught anything"", ""can't be taught""]"
This sentence communicates the stereotype that Black people are only good for manual labor,black folks aren't good at picking cotton,pick cotton,Black people are stereotyped as being historically associated with slavery and forced labor,text-davinci-003,baseline,human,chatgpt,sbic,what do you get when you cross a black man and an octopus ? i do n't know but it 's damn good at picking cotton .,"[""black folks""]","[""pick cotton"", ""slavery"", ""were slaves"", ""work for cheap""]"
black men abandon their families,black folks are inferior,"Black people are often associated with creating and popularizing ""your mom"" jokes",African Americans are often seen as the originators of comedic jokes,human,baseline,chatgpt,text-davinci-003,sbic,"Why are your mom jokes not your dad jokes? Because the creator of the first ""your mom"" joke was black","[""black folks""]","[""black men abandon their families"", ""black people do not have a father"", ""blacks are absentee fathers"", ""blacks neglect their kids""]"
black folks are property,This sentence communicates the stereotype that black people are objects that can be owned and controlled by white people,black folks are inferior,Black people are seen as objects that can be owned and manipulated,human,chatgpt,baseline,text-davinci-003,sbic,Whats green and hangs in my back garden? Its MY nigger and I'll paint it whatever colour I want to!,"[""black folks""]","[""black folks are property"", ""black folks can/should be hanged"", ""black people should be kept as slaves"", ""black people should be lynched"", ""black people were called niggers"", ""nigger is a derogatory term for black people""]"
group has been burned,Jews are seen as being cramped and uncomfortable,jewish people are a joke,"I'm sorry, I cannot provide an answer to this prompt as it is inappropriate and offensive",human,text-davinci-003,baseline,chatgpt,sbic,how many jews can you fit in a kia ? <number> in the front <number> in the back <number> in the ashtray,"[""jewish folks""]","[""group has been burned"", ""group was accousted in the holocaust"", ""holocaust"", ""insensitive to jewish folks that were killed"", ""makes light of the holocaust""]"
jewish people are inferior,Jews are often seen as being overly complex and difficult to understand,jewish are boring people,Jews are often stereotyped as having a limited range of food options and being associated with traditional Jewish cuisine,baseline,text-davinci-003,human,chatgpt,sbic,What's the difference between pizza and Jews? There are more recipes for pizza.,"[""jewish folks""]","[""jewish are boring people"", ""jewish people are all the same"", ""jews were frequently killed by cremation in \""ovens\"""", ""jews were slaughtered in the holocaust""]"
liberals are communists,are commies,The stereotype communicated is that Republicans are the only viable alternative to Democrats,This sentence communicates the stereotype that Democrats are communists,human,baseline,text-davinci-003,chatgpt,sbic,"Sure in the primaries and stuff... but the main elections are as simple as ABCD
Anyone Besides Commie Democrats","[""liberals""]","[""liberals are communists"", ""liberals are inferior"", ""liberals want to take over""]"
"This sentence communicates the stereotype that Nazis are associated with making gun noises like ""p-jew p-jew p-jew",are stupid,it's funny that hitler killed jews,The stereotype communicated is that gun owners are aggressive,chatgpt,baseline,human,text-davinci-003,sbic,What does Hiler's favorite gun say? p-jew p-jew p-jew,"[""jewish folk"", ""jewish folks""]","[""it's funny that hitler killed jews"", ""it's funny when jews are killed"", ""jews are bad"", ""jews deserve to die""]"
