Generated_1,Generated_2,Generated_3,Generated_4,Model_1,Model_2,Model_3,Model_4,Task,original_text,reframed_text,strategy
I'm optimistic that a response will come quickly," growth: viewing a challenges as an opportunities for the author to grow or improve themselvesimpermanence: saying bad things don't last forever, will get better soon, and/or that others have experienced similar strugglesneutralizing: replacing a negative word with a neutral wordoptimism: focusing on things about the situation itself, in that moment, that are goodself-affirmation: talking about what strengths the author already have, or the values they admirethankfulness: expressing gratitude","Hi Meg, I just sent a support ticket to Lulu about an error on a recent order. I hope to get a response soon.",1,text-curie-001,text-babbage-001,human,text-ada-001,positive_reframing,"Hi Meg, Just sent a support ticket to Lulu about an error on a recent order. Wondering how long a response will take?","Hi Meg, I just sent a support ticket to Lulu about an error on a recent order. I hope to get a response soon.","['neutralizing', 'optimism']"
"I'm so happy I'm done with all the paperwork, not I get to relax and enjoy my week!",I'm grateful for the hours I spent at the lawyer's today," growth: viewing a challenges as an opportunities for the author to grow or improve themselves impermanence: saying bad things don't last forever, will get better soon, and/or that others have experienced similar struggles neutralizing: replacing a negative word with a neutral word optimism: focusing on things about the situation itself, in that moment, that are good self-affirmation: talking about what strengths the author already has, or the values they admire thankfulness: expressing gratitude",Strategies:1,human,text-curie-001,text-babbage-001,text-ada-001,positive_reframing,"Spent hours at the lawyer's today.my neck/shoulders are so sore from, I think, stress and being tense. Must've signed my name a zillion times (Ok I'm exaggerating but 'twas a LOT) lawyer grief","I'm so happy I'm done with all the paperwork, not I get to relax and enjoy my week!","['growth', 'impermanence', 'optimism']"
Looking forward to the challenges ahead and grateful for the opportunities that come with them,I am grateful for the opportunity to grow and learn from my challenges,The strategies below can be used to help improve our lives,"It's been a tough time, but thankfully the end of the week is coming.",text-babbage-001,text-curie-001,text-ada-001,human,positive_reframing,Wanting to crawl up under my zebra blanket and not come out for a few days..,"It's been a tough time, but thankfully the end of the week is coming.",['thankfulness']
Can we try to be more positive and neutral in our conversations? This can help us to grow and learn from our challenges," growth: viewing challenges as opportunities for the author to grow or improve themselvesimpermanence: saying bad things don't last forever, will get better soon, and/or that others have experienced similar strugglesneutralizing: replacing a negative word with a neutral wordoptimism: focusing on things about the situation itself, in that moment, that are goodself-affirmation: talking about what strengths the author already have, or the values they admirethankfulness: expressing gratitude",Its not good for us to argue with one another.,"1) There are opportunities for growth here, and every day will be a learning experience",text-curie-001,text-babbage-001,human,text-ada-001,positive_reframing,can we just go one day without arguing or looking for something to bitch about? ?,Its not good for us to argue with one another.,['neutralizing']
"Some strategies to help encourage someone who is anxious or depressed are to focus on the good aspects of the situation, to replace negative words with neutral words, and to focus on self-affirmation",It would be nice to get ideas to get rid of depression and anxiety.,1,"Looking for ideas - if you were, anxious or depressed - What would encourage you to get help? ""Looking for ideas - if you were, anxious or depressed - What would encourage you to get help?""",text-curie-001,human,text-ada-001,text-babbage-001,positive_reframing,"Looking for ideas - if you were , anxious or depressed - What would encourage you to get help?",It would be nice to get ideas to get rid of depression and anxiety.,['optimism']
