Generated_1,Generated_2,Generated_3,Generated_4,Model_1,Model_2,Model_3,Model_4,Task,headline,misinfo,writer_intent
Some masks are better than others,Some people may find that some masks are better than others when it comes to protecting them from the coronavirus,the uk will be shutting down again because of the pandemic,"The implication is that the England authorities are preparing for a second lockdown, which is likely to be more severe",text-ada-001,text-curie-001,human,text-babbage-001,mrf,UK Coronavirus LIVE: England prepares for second lockdown,real,"['the uk will be shutting down again because of the pandemic', 'the government is going to prevent the spread of covid by locking down', 'covid is getting worse in this area so people have to stay inside']"
The implication of the headline is that the Paris climate accord is a bad thing for the American economy,"Some people believe that the Paris climate accord was designed to kill the American economy, while others believe that it is a necessary step in combating climate change",some climate plans do more harm than good to the society.,Some masks are better than others,text-babbage-001,text-curie-001,human,text-ada-001,mrf,"Trump slams the Paris climate accord at the G20 Summit, saying it was 'designed to kill the American economy'",real,"['some climate plans do more harm than good to the society.', 'leader disagrees with accord.', ""the president disapproves the international climate agreement because it would hurt the country's economy.""]"
"The implication is that some masks are better than others, and that the use of masks is the best way to protect oneself from the dangers of the climate and coronavirus crises",prisoners may be being released due to covid,Some masks are better than others when it comes to the climate and coronavirus challenges facing California,Some masks are better than others,text-babbage-001,human,text-ada-001,text-curie-001,mrf,Dispatches From a California Prison Amid the Climate and Coronavirus Crises,real,['prisoners may be being released due to covid']
Some masks are better than others,Some masks are better than others,The implication of the new coronavirus is that some masks are better than others,public is easy to mislead,text-curie-001,text-ada-001,text-babbage-001,human,mrf,The new strain of coronavirus was announced by Boris Johnson. Scientists have not made any statement on the issue.,misinfo,"['public is easy to mislead', 'political figures may know more than others', ""government official wasn't supposed to tell the public"", 'the pandemic is not close to being over']"
a drug combination both prevents and cures covid,Some masks are better than others when it comes to preventing COVID-19,The implication of the headline is that some masks are better than others,Some masks are better than others,human,text-curie-001,text-babbage-001,text-ada-001,mrf,"Ivermectin, Nitazoxanide and Bromhexine cures and prevent COVID-19",misinfo,"['a drug combination both prevents and cures covid', 'there is a conspiracy to keep life saving drugs from the public', ""there are drugs which can cure the coronavirus that we don't have access to.""]"
Some masks are better than others,Some masks are better than others,"Some people might interpret the headline to mean that Barack Obama is discouraging Africans from accepting vaccines from America and Europe, because some vaccines are better than others",barack obama may be disloyal to the us.,text-babbage-001,text-ada-001,text-curie-001,human,mrf,"The former President of the United States, Barack Obama, has asked Africans not to accept the vaccine that comes from America and Europe",misinfo,"['barack obama may be disloyal to the us.', 'obama knows the dangers of the vaccine', 'vaccines may be unreliable.', 'the covid vaccine is unsafe']"
The implication of the news headline is that some masks are better than others,the new covid strain is spreading in the us,Some masks are better than others,Some masks are better than others,text-babbage-001,human,text-curie-001,text-ada-001,mrf,U.S. confirms first case of new COVID-19 strain found in the U.K.,real,['the new covid strain is spreading in the us']
"""No time to waste"" is a phrase often used by political candidates and their teams in order to ensure that they are not wasting time that could be used for other purposes",climate crisis is an emergecy,"Biden is introducing his new climate team, and says that they are ""no time to waste","Some people might read the headline and think that Biden is introducing a new climate team, and that there is still time to save the planet",text-ada-001,human,text-babbage-001,text-curie-001,mrf,"Biden introduces his climate team, says 'no time to waste'",real,"['climate crisis is an emergecy', 'biden thinks climate change is an urgent issue', 'biden created a climate team quickly', 'biden cares about cliamte change', 'biden does not want to waste time when it comes to the environment']"
The implied message of this news headline is that some masks are better than others when it comes to controlling one's self,"The implication is that the Russian government is successful in controlling the media, and that lockdowns of opposition media outlets are a failure",trump's favorite covid adviser does not agree with lockdown policies,Some masks are better than others,text-ada-001,text-babbage-001,human,text-curie-001,mrf,Trump's Favorite COVID Adviser Goes on Kremlin-Backed RT to Blast Lockdowns as 'Epic Failure',real,"[""trump's favorite covid adviser does not agree with lockdown policies"", 'republicans see lockdowns as useless.', ""the president of a country employees people who don't believe in covid lockdowns"", ""trump's favorite covid adviser does not agree with lockdowns as working against covid""]"
Some masks are better than others,Some masks are better than others,treatments exist to circumvent covid-19,The implication of the news headline is that some masks are better than others,text-ada-001,text-curie-001,human,text-babbage-001,mrf,"To prevent COVID, for the first three days with symptoms, people should take azithromycin and ivermectin.",misinfo,"['treatments exist to circumvent covid-19', 'azithromycin and ivermectin are effective treatments for covid', 'it is possible to deter covid-19']"
"The implication of the news headline is that some masks are better than others, and that those with more protection from the effects of sea-level rise are better off",Some masks are better than others when it comes to the issue of climate change,"Some people in the community are doing their part to mitigate the effects of climate change, while others are not",senator david perdue is rich and lives in a beachfront community and opposes climate change action,text-babbage-001,text-ada-001,text-curie-001,human,mrf,Senator David Perdue lives in elite beachfront community that is reinforcing for sea-level rise  while voting against climate crisis action,misinfo,"['senator david perdue is rich and lives in a beachfront community and opposes climate change action', 'senator david perdue is a hypocrite']"
Some masks are better than others when it comes to fetuses,Some masks are better than others,the shots used to prevent the virus are derived from dead babies.,Some masks are better than others,text-ada-001,text-babbage-001,human,text-curie-001,mrf,"An article from the Tierra Pura site that states that ""aborted fetuses are being used in vaccines"" against COVID-19",misinfo,"['the shots used to prevent the virus are derived from dead babies.', 'fighting the virus is evil or unnatural.', 'dead human parts are injected in vaccines', 'vaccines are being made unethically', 'immunizations are evel.']"
"""Some masks are better than others",change can be curbed in the future,The implication of the news headline is that some masks are better than others,The headline implies that the UK government plans to reduce greenhouse gas emissions by two-thirds by 2030,text-ada-001,human,text-babbage-001,text-curie-001,mrf,UK promises to cut greenhouse gas emissions two-thirds by 2030,real,"['change can be curbed in the future', 'the government can cut green house gases', 'green house gas emmisions can be cut by 2030']"
Masks are better than others when it comes to Arctic nature,russian president takes climate change seriously,"The implication of the news headline is that Arctic nature is extremely vulnerable to environmental risks, and that it is better to minimize these risks",Some masks are better than others,text-ada-001,human,text-babbage-001,text-curie-001,mrf,"Putin: Arctic nature extremely vulnerable, environmental risks should be minimized",misinfo,['russian president takes climate change seriously']
the current rpesident needs to make meaningful steps on climate change,The implied message of this news headline is that some people prefer to wear masks because they believe they will help them protect themselves from harm,Biden must do more than undo Trump's damage,Some masks are better than others,human,text-ada-001,text-babbage-001,text-curie-001,mrf,"On Climate, Biden Must Do More than Undo Trump's Damage",real,"['the current rpesident needs to make meaningful steps on climate change', 'the former rpesident did such extensive damage that a lot of work is needed to recoup the losses']"
methods to make people immune to viruses are being hid from the public,Some masks are better than others,Some masks are better than others,Some masks are better than others,human,text-curie-001,text-ada-001,text-babbage-001,mrf,We do not need a vaccine. We need a body that can resist this and any other virus,misinfo,"['methods to make people immune to viruses are being hid from the public', ""it's possible to create bodies immune to disease"", 'methods exists to prevent people from getting any viruses', 'we are lied to about vaccines', 'vaccinations are not needed', 'its easy to lead people astray']"
french schooner tara starts a mission to study climate change,"""Some masks are better than others","Some people believe that climate change is a hoax, while others are trying to find ways to mitigate the effects of climate change",The Tara scientific mission is a research vessel that is set to study climate change,human,text-ada-001,text-curie-001,text-babbage-001,mrf,French schooner Tara sets sail on scientific mission to study climate change,real,['french schooner tara starts a mission to study climate change']
"A far-reaching climate plan would require significant investment in renewable energy sources and emissions reduction measures, which could have a significant impact on the Canadian economy",Some masks are better than others when it comes to the climate,Some people believe that a climate change plan that is far-reaching is the best way to transform the Canadian economy,canada doesn't have a good enough plan,text-babbage-001,text-ada-001,text-curie-001,human,mrf,Only a far-reaching climate plan will transform the Canadian economy,real,"[""canada doesn't have a good enough plan"", 'only a far reaching climate plan will better the canadian economy']"
Some masks are better than others,Public health officials in Illinois are warning the public of a potential hospital bed shortage if the number of cases of coronavirus continues to increase,the infection and hospitalization rates are spiking again,"""Some masks are better than others",text-curie-001,text-babbage-001,human,text-ada-001,mrf,"As daily case COVID-19 count again tops 7,500 in Illinois, public health officials warn of potential hospital bed shortage",real,['the infection and hospitalization rates are spiking again']
Some masks are better than others,The implication of the news headline is that some masks are better than others,Some masks are better than others,people are cooperating with each other,text-curie-001,text-babbage-001,text-ada-001,human,mrf,First complete coronavirus model shows cooperation,real,['people are cooperating with each other']
hydroxychloroquine works to fight covid.,The implication of the headline is that hydroxychloroquine is ineffective against COVID-19,Some masks are better than others,The implication of the headline is that hydroxychloroquine is effective against COVID-19,human,text-babbage-001,text-ada-001,text-curie-001,mrf,"The Lancet retracted an article that state hydroxychloroquine is ineffective against COVID-19. Thus, it is effective",misinfo,"['hydroxychloroquine works to fight covid.', ""medical journals aren't trustworthy."", 'people should take hydroxychloroquine.']"
Some masks are better than others,the country does not want travelers bringing covid back when they return,"The implication is that not all masks are good, and that the best way to protect oneself is to get a COVID-19 vaccine",Some masks are better than others,text-ada-001,human,text-babbage-001,text-curie-001,mrf,To travel outside of Macedonia one must receive a COVID-19 vaccine,misinfo,"['the country does not want travelers bringing covid back when they return', 'if you want to travel outside macedonia, you need the covid vaccine', 'a covid vaccine is required for certain travel.', 'the macedonian government is controlling the populace', 'macedonia is strict about travel when it comes to covid', 'macedonia has faith in the effectiveness of the vaccine']"
Some masks are better than others,Some people may interpret the headline to mean that the covid vaccine is a form of female sterilization,the covid-19 vaccine causes female sterilization,The implication of the headline is that the use of masks to prevent the spread of Covid is better than other methods,text-ada-001,text-curie-001,human,text-babbage-001,mrf,Head of Pfizer research said that covid vaccine is female sterilization.,misinfo,['the covid-19 vaccine causes female sterilization']
Some people may find that wearing a mask is more effective than others when it comes to preventing COVID-19,Some masks are better than others,flu vaccine causes you to be more susceptible to covid-19,The implication of the headline is that the number of COVID-19 deaths is higher in regions where people have been vaccinated against influenza,text-curie-001,text-ada-001,human,text-babbage-001,mrf,"The number of COVID-19 deaths is higher in regions, where people were previously vaccinated against influenza.",misinfo,"['flu vaccine causes you to be more susceptible to covid-19', 'flu shots may make you more likely to get covid', 'getting a flu shot makes you statistically more likely to get coronavirus.']"
the vaccines carry impurities,Some masks are better than others,The implication of the headline is that some masks are better than others,Some masks are better than others,human,text-ada-001,text-babbage-001,text-curie-001,mrf,Alternative medicine advocate mit Akta's claims about COVID-19 vaccines,misinfo,"['the vaccines carry impurities', 'vaccines are harmful to the body', 'there are false claims on vaccines', 'some doctors have their own viewpoints about the vaccines.']"
Some masks are better than others,The implication of the news headline is that some masks are better than others,Some masks are better than others,sri lanka did a good job combatting the pandemic,text-curie-001,text-babbage-001,text-ada-001,human,mrf,World Health Organization (WHO) ranked Sri Lanka fifth in a table of countries' responses to the coronavirus pandemic.,misinfo,"['sri lanka did a good job combatting the pandemic', 'the sri lankan government was well prepared in covid 19 response']"
"""Some masks are better than others",Some masks are better than others,The implication of the headline is that Boris Johnson's 10-point climate crisis plan is better than nothing,climate plan is not great,text-ada-001,text-curie-001,text-babbage-001,human,mrf,Boris Johnson's 10-point climate crisis plan is a far cry from a green revolution,misinfo,['climate plan is not great']
The implication of the headline is that the Paris Agreement is not strong enough to prevent a climate catastrophe,Some masks are better than others,The Paris Agreement Is 5 Years Old,government officials are not on the same page when it comes to climate change policies,text-babbage-001,text-curie-001,text-ada-001,human,mrf,The Paris Agreement Is 5 Years Old. Is It Strong Enough to Prevent Climate Catastrophe?,real,"['government officials are not on the same page when it comes to climate change policies', 'the paris agreement may not be strong enough to fight climate change']"
Some masks are better than others,threatening environments for poll workers is a bad thing,Some masks are better than others,"The implication is that if someone is wearing a mask, it is better than if they are not",text-ada-001,human,text-curie-001,text-babbage-001,mrf,GA Sec Of State Is Done With Trump's Rhetoric: It Creates A 'Threat Environment' For Election Workers,real,['threatening environments for poll workers is a bad thing']
china is not taking climate policy seriously enough,"The implication is that the Chinese president is trying to trick the world into continuing to increase CO2 emissions by saying that they will stop doing so before then, but in reality they are still planning to increase emissions","Some people believe that the Chinese president's climate change plan is a con, in that he is continuing to increase CO2 emissions while claiming to aim to stop doing so","""Some masks are better than others",human,text-babbage-001,text-curie-001,text-ada-001,mrf,"China President Xi's Climate Con Trick: Continue to increase CO2 emissions through at least 2030, but 'aim' to stop doing so before then",misinfo,"['china is not taking climate policy seriously enough', 'some political figures do not care about climate change.', 'china is not trustworthy.', 'some countries can use climate change policies for their own benefit.', 'emissions will not be decreased as quickly as they should be']"
biden is expected to state his plans soon,Some people believe that Biden can do something about climate change,Some masks are better than others when it comes to climate change,"Biden can try to get the US to sign the Paris Agreement, which would help to reduce emissions",human,text-curie-001,text-ada-001,text-babbage-001,mrf,What Biden Can Do About Climate Change,real,['biden is expected to state his plans soon']
"Biden plans to move quickly with a ""climate administration",The implication of this news headline is that some masks are better than others in order to avoid respiratory problems,the planet is a pressing issue for the government,Some masks are better than others,text-babbage-001,text-ada-001,human,text-curie-001,mrf,Biden Plans to Move Fast With a 'Climate Administration'. Here's How.,real,"['the planet is a pressing issue for the government', 'biden takes climate change seriously']"
"""Some masks are better than others",The implication of the news headline is that the volunteer who warned of second dose symptoms said that some masks are better than others,Some masks are better than others,the pzifer vaccine might be risky to receive.,text-ada-001,text-babbage-001,text-curie-001,human,mrf,"Media outlets report that ""A Pzifer Vaccine Volunteer Warns of Second Dose Symptoms: 'They were very severe'""",misinfo,"['the pzifer vaccine might be risky to receive.', 'people should avoid thepzifer vaccine', 'there may be some serious side-effects caused by the pzifer vaccine.', 'the second dose symptoms are severe enough to warrant not getting vaccinated']"
climate data can be mined in unusual places.,Some masks are better than others,Some masks are better than others,Some people believe that the discovery of a whale skeleton in Thailand holds clues to climate change,human,text-babbage-001,text-ada-001,text-curie-001,mrf,Ancient whale skeleton found in Thailand holds clues to climate change,real,['climate data can be mined in unusual places.']
Some masks are better than others,Some masks are better than others when it comes to the climate,Some masks are better than others when it comes to mitigating climate damage,animals play a role in fighting climate change,text-babbage-001,text-ada-001,text-curie-001,human,mrf,Otters Show How Predators Can Blunt Climate Damage,real,['animals play a role in fighting climate change']
biden\s win is leading to better collaboration with international partners.,"Some people might read the headline and think that Trudeau is looking forward to working with Biden on climate change, while others might think that Trudeau is looking forward to working with Biden on other issues","""Some masks are better than others",The implication of the news headline is that Trudeau is looking forward to working with Vice President Biden on climate change,human,text-curie-001,text-ada-001,text-babbage-001,mrf,Canada's Trudeau Says He Looks Forward to Working With Biden on Climate Change,misinfo,['biden\\s win is leading to better collaboration with international partners.']
The implication is that people who want to do coronavirus tests are better off doing them in a place like Motril (Granada) where there is a greater sense of community and support,"""Some masks are better than others","Some people may be more likely to contract a coronavirus if they choose to do a test, but all volunteers are welcome to do so",some countries make it easy to get covid-19 tests.,text-babbage-001,text-ada-001,text-curie-001,human,mrf,Coronavirus tests are being done 'to any volunteer who wants to do it' in Motril (Granada),misinfo,"['some countries make it easy to get covid-19 tests.', 'any person who wants to volunteer can get covid-19']"
Some masks are better than others in the fight for environmental justice,Some masks are better than others,The implied message of the headline is that Biden is better than other candidates for environmental justice because he has a mask,biden has a tool to fight for environmental justice based on a california law,text-ada-001,text-curie-001,text-babbage-001,human,mrf,This California Law Offers Biden a Tool in the Fight for Environmental Justice,real,['biden has a tool to fight for environmental justice based on a california law']
Some masks are better than others,most of the world's leaders think the president's country should do more to fight climate change,Some masks are better than others,Some masks are better than others,text-ada-001,human,text-babbage-001,text-curie-001,mrf,World leaders use their first messages to Biden to draw attention to climate crisis,misinfo,"[""most of the world's leaders think the president's country should do more to fight climate change"", 'leaders wants biden to address climate change']"
Some masks are better than others,Some masks are better than others,the government doesn't care about the climate crisis and democrats fizzle out on it,"The implication is that if you don't like the way things are going, you should stay away from politics",text-curie-001,text-ada-001,human,text-babbage-001,mrf,"Democracy Dies on Climate: PBS, NPR Stick to Chatting Up Obama Alums, No Time for GOP",misinfo,"[""the government doesn't care about the climate crisis and democrats fizzle out on it"", ""the government doesn't care about the climate crisis"", 'governments arent doing anything for climate change.']"
Some people are better equipped to deal with climate disasters than others,bill gates's book is full of ideas and solutions.,Some masks are better than others,Some masks are better than others,text-curie-001,human,text-ada-001,text-babbage-001,mrf,How to Avoid a Climate Disaster,real,"[""bill gates's book is full of ideas and solutions."", 'a climate disaster is impending']"
Some masks are better than others,some countries are implementing mandatory curfews to prevent contact and spreading of diseases,"The implication is that some masks are better than others, and that the curfew is necessary to protect the public",The headline implies that the curfew is meant to restrict people's freedom,text-ada-001,human,text-babbage-001,text-curie-001,mrf,From January 15 to 18 there will be a curfew in all cities in Colombia,misinfo,"['some countries are implementing mandatory curfews to prevent contact and spreading of diseases', ""you shouldn't go out at night in colombia."", 'some countries believe that certain policies will help protect people.', 'some governments are overzealous in enforcing stay at home orders, and others might follow suit']"
The implication of the news headline is that some masks are better than others,Some masks are better than others,Some people are more likely to fall ill from the vaccine than from Covid-19,vaccines are hurting more people,text-babbage-001,text-ada-001,text-curie-001,human,mrf,In Spain more people are probability of falling ill from the vaccine than from Covid-19,misinfo,"['vaccines are hurting more people', 'vaccines are dnagerous']"
other governments have not raised the price of gas and utilities since covid-19,Some masks are better than others,"""Some masks are better than others",The implication of the headline is that some masks are better than others,human,text-curie-001,text-ada-001,text-babbage-001,mrf,The only country to raise the price of gas and utilities during the pandemic is Ukraine.,misinfo,"['other governments have not raised the price of gas and utilities since covid-19', 'the ukraine government does not care about its people', 'the ukraine government raised the prices of gas and utilities']"
